Start Time,End Time,Text,translated_text
696.04,698.0799999999999, But definitely I'm not an artist.,Aber definitiv bin ich kein Künstler.
698.0799999999999,702.68, I'm a journalist and I like to get stuff published.,"Ich bin Journalist und ich mag es, Dinge zu veröffentlichen."
702.68,708.9599999999999, I like to make money and I like to get a lot of readers if I possibly can.,"Ich mag Geld verdienen und ich mag eine Menge Leser, wenn ich kann."
708.9599999999999,711.3199999999999," So, have I changed with the times?",Habe ich mich also mit der Zeit verändert?
711.32,714.12," Well, God, what a strange person I would be if I hadn't.","Nun, Gott, was für eine seltsame Person wäre ich, wenn"
