Start Time,End Time,Text,translated_text
0.0,8.16," After humiliating defeats in Ukraine, Russian President Vladimir Putin told his people that",Nach demütigenden Niederlagen in der Ukraine hat der russische Präsident Wla
8.16,14.8," the U.S. has bent on destroying the Russian homeland. On Wednesday he drafted 300,000",- Während der ersten Woche des ersten Jahres des ersten Jahres des ersten
14.8,20.64," reservists and threatened nuclear war. This is not a bluff, he said.",Während der ersten Woche des ersten Jahres des Jahres hat die deutsche Regierung die
20.64,26.2," Ukraine dominated this past week's annual gathering of the UN General Assembly in New York,",Die Ukraine hat die jährliche Tagung der UN-Generalversammlung in New York in
26.2,33.64, attended by President Biden and more than 120 world leaders. Friday we met the U.S. Secretary,Präsident Biden und über 120 führende Persönlichkeiten aus aller Welt trafen sich am
33.64,39.96," of State, Antony Blinken, to talk about a world of challenges and Putin's nuclear threat.","Antony Blinken, Staatsoberhaupt, um über eine Welt der Herausforderungen und"
41.96,43.96, The story will continue in a moment.,Die Geschichte wird in einem Moment fortgesetzt.
47.64,52.92, How concerned should Americans be about the prospect of nuclear war?,Wie besorgt sollten die Amerikaner über die Aussicht auf einen nuklearen Krieg
53.0,60.52," Scott, we've heard a lot of irresponsible rhetoric coming out of Vladimir Putin, but we're focused on","Scott, wir haben eine Menge unverantwortlicher Rhetorik von Wladimir"
60.52,66.76," making sure that we're all acting responsibly, especially when it comes to this kind of loose rhetoric.","sicherzustellen, dass wir alle verantwortungsbewusst handeln, insbesondere"
66.76,73.08, We have been very clear with the Russians publicly and as well as privately to stop the loose talk,"Wir haben uns gegenüber den Russen öffentlich und privat sehr deutlich dafür eingesetzt, das schwache"
73.08,74.36, about nuclear weapons.,über Atomwaffen.
74.36,80.84," Privately, the United States has been in communication with the Kremlin about these threats of nuclear war.",Privat standen die Vereinigten Staaten mit dem Kreml in Kontakt über diese Dr
80.84,88.28," Yes, it's very important that Moscow hear from us and know from us that the consequences","Ja, es ist sehr wichtig, dass Moskau von uns hört und von"
89.08,95.56," would be horrific and we've made that very clear. You call the nuclear talk, loose talk,","Sie nennen das Nukleargespräch, das schwache Gespräch, das heißt, das"
96.28,102.28, but isn't Vladimir Putin telling us what he's going to do if he is back to any further,"Aber sagt uns nicht Vladimir Putin, was er tun wird, wenn er wieder zu"
102.28,103.4, into a corner?,in eine Ecke?
103.4,109.48, Vladimir Putin has a clear way out of the war he started and that's to end it. If Russia stops fighting,"Vladimir Putin hat einen klaren Ausweg aus dem Krieg, den er begonnen hat"
110.28,113.88," the war ends. If Ukraine stops fighting, you can ends.","Wenn die Ukraine aufhört zu kämpfen, kann man es beenden."
114.6,120.6, Is there anyone in the Kremlin who can tell Vladimir Putin know if he decides to launch a battlefield,"Gibt es im Kreml jemanden, der Wladimir"
120.6,130.84," nuclear weapon? They have a chain of command whether it works or not to be seen, but I think what",Die Europäische Union hat eine ganze Reihe von militärischen und mili
130.84,136.84, you're pointing to is a larger challenge and that is the Achilles' heel of autocracies anywhere.,"es ist eine größere Herausforderung, auf die du hinweisst, und das ist"
136.84,143.4, There is usually not anyone who has the capacity or the will to speak truth to power.,"In der Regel gibt es niemanden, der die Fähigkeit oder den Willen"
143.4,150.2, And part of the reason I think Russia has gotten itself into the mess that it's in is because,"Und ein Teil des Grundes, warum ich glaube, dass Russland sich in das"
150.2,154.6, there is no one in the system to effectively tell Putin he's doing the wrong thing.,"es gibt niemanden im System, der Putin faktisch sagen kann, dass"
154.6,160.44," In our interview last week, President Biden told us that he had a message for Vladimir Putin","In unserem Interview letzte Woche sagte Präsident Biden, er habe eine Botschaft an Vladimir"
160.44,162.44, on the use of nuclear weapons.,zur Verwendung von Kernwaffen.
162.6,171.96, Don't. Don't. He went on to say the US response would be consequential.,"Nein. Nein. Er fuhr fort, dass die Reaktion der USA Konsequenzen"
172.52,173.72, What did he mean by that?,Was hat er damit gemeint?
173.72,178.68, I'm not going to get into what the consequences would be. Any use of nuclear weapons,Ich werde nicht auf die Folgen eingehen.
178.68,185.16," would have catastrophic effects for, of course, the country using them, but for many others as well.","katastrophale Auswirkungen für das Land, das sie einsetzt, aber"
185.16,190.44," If you can't give a specifics about a US response, can you tell us that the administration has a plan?","Wenn Sie keine konkreten Angaben zu einer Reaktion der USA machen können, können Sie uns sagen"
191.24,196.36, We do. Is it a plan that would prevent World War III?,"Wir tun es. Ist es ein Plan, der den dritten Weltkrieg verhindern"
197.16,201.96, President Biden has been determined that as we're doing everything we can to help the Ukrainians,"Präsident Biden ist entschlossen, dass wir alles in unserer Macht Steh"
201.96,206.68," defend themselves, as we're doing everything we can to rally other countries, to put pressure on","verteidigen sich, da wir alles in unserer Macht Stehende tun,"
206.68,210.76," Russia, we're also determined that this war not expand, not get broader.","Russland, wir sind auch entschlossen, dass dieser Krieg nicht ausdehnen, nicht"
211.4,212.12, Excuse me.,Entschuldigen Sie.
212.12,219.32," As we were speaking to Secretary Blinken, news broke that a UN investigative commission had found","Als wir mit Sekretär Blinken sprachen, erfuhr man"
219.32,227.16, evidence of rape and torture of children in Russian-occupied Ukraine. The panel goes on to say,Die Kommission weist weiterhin auf die Vergewaltigung und Folter von Kindern
227.16,233.4," based on the evidence gathered by the commission, it has concluded that war crimes have been",aufgrund der von der Kommission gesammelten Beweise ist sie zu dem Schluss
233.4,240.04, committed in Ukraine. What does justice look like for Ukraine?,Wie sieht die Gerechtigkeit für die Ukraine aus?
241.08,248.92," Justice looks like accountability, accountability for those who perpetrated these war crimes,","Gerechtigkeit sieht wie Rechenschaftspflicht aus, Rechenschaftspflicht für die"
248.92,254.52," these atrocities, as well as for those who ordered them. It's one of the reasons Scott, why","hnlich wie die anderen, hat er es geschafft, die"
255.24,259.4," we're doing everything we can, to support those who are trying to compile the evidence,","Wir tun alles, um diejenigen zu unterstützen, die versuchen, Beweise zu sammeln,"
260.6,264.84," and to investigate, and ultimately to prosecute those responsible.",und zu untersuchen und schließlich die Verantwortlichen zu verfolgen.
264.84,267.72, To prosecute? Do you believe there should be war crime trials?,"Sind Sie der Meinung, dass es Prozesse gegen Kriegsverbrecher geben sollte"
267.72,271.88," I was in Ukraine a couple of weeks ago. One of the places I visited was a city called Erpen,","Ich war vor einigen Wochen in der Ukraine, und eines der Orte, die"
272.52,278.12," and I saw residential buildings, building block after building block, totally bombed out.","und ich sah Wohngebäude, Baustein für Baustein, völlig abge"
279.0,285.0," This was the totally indiscriminate use of force. Wherever the Russian tide recedes,",Das war der völlig willkürliche Einsatz von Gewalt.
285.56,289.24, what's left in its wake is very clear evidence of atrocities and war crimes.,"Was im Gefolge bleibt, sind ganz klare Beweise für Gräueltaten"
289.8,291.48, The bodies I saw were not fake.,"Die Körper, die ich sah, waren nicht gefälscht."
292.12,296.68," Attracities were laid before the UN Security Council last Thursday,",Der UN-Sicherheitsrat hat am vergangenen Donnerstag At
297.40000000000003,301.32," drawing from the Russian Foreign Minister, a dubious defense.","gezogen aus dem russischen Außenminister, eine zweifelhafte Verteidigung."
302.12,310.12," When Sergei Lavrov says that the atrocities have been staged, and it is Russia that is the victim,","Wenn Sergei Lavrov sagt, die Gräueltaten seien ins"
311.16,313.4, Tony Blinken is sitting there thinking what?,Tony Blinken sitzt da und denkt was?
314.44,319.0," This is Alice in Wonderland. It's the world upside down. Up is down, white is black,",Dies ist Alice in Wonderland. Es ist die Welt auf den Kopf gestellt.
319.96,326.36," truth is false. But here's the things Scott, all of these words,",
326.76,332.92, all of these words ring totally hollow to every member on the Security Council.,all diese Worte klingen für jedes Mitglied des Sicherheitsrates völlig
332.92,342.36," So this spewing of words is not having an effect. On the contrary, I think it just shows the total","Dieses Wortsprühen hat also keine Wirkung, sondern ich denke"
342.36,347.72, disconnect between Russia and virtually the entirety of the rest of the world.,- Trennung zwischen Russland und praktisch der gesamten übrigen Welt.
348.68,354.6," At the moment we spoke to the Secretary, Russia was hurrying through what it calls elections","Im Moment, da wir mit dem Sekretär gesprochen haben, beschleunigt"
355.08000000000004,361.48, to force these areas of Ukraine's occupied East and South into the Russian Federation.,Diese Gebiete des besetzten Ostens und Südens der Ukraine in die Ru
362.04,368.84," These so-called elections are a sham period. They go in, they put in puppet governments,","Diese so genannten Wahlen sind eine Scheinzeit: Sie treten ein, sie"
368.84,375.24," local governments, and then they proceed with a vote, which they'll manipulate in any event","lokale Regierungen, und dann treten sie mit einer Abstimmung fort, die"
376.12,382.52," in order to try to declare the territory, Russian territory. It is not, it will never be recognized","Um zu versuchen, das Territorium, das russische Territorium, zu erklären,"
382.52,386.36," as such, and the Ukrainians have every right to take it back.","als solche, und die Ukrainer haben jedes Recht, sie zurückzunehmen."
387.48,393.48, Blinken came to our interview after meeting China's foreign minister. China has been raising,Blinken kam zu unserem Interview nach einem Treffen mit dem chinesischen Außenminister
393.48,398.6," pressure on the Democratic island of Taiwan, which in our conversation last week,","Druck auf die demokratische Insel Taiwan, die in unserem Gespräch letzte Woche,"
399.16,402.36, President Biden pledged to defend with force.,"Präsident Biden hat sich verpflichtet, mit Gewalt zu verteidigen."
403.08,410.28," So, unlike Ukraine to be clear, sir, US forces, US men and women would defend Taiwan","Anders als die Ukraine, um es klar zu sagen, Herr, würden die US"
410.28,412.68, in the event of a Chinese invasion. Yes.,im Falle einer chinesischen Invasion.
413.72,421.8, But official US policy is and has been for decades to remain ambiguous about defending the island.,Doch die offizielle Politik der USA ist und ist seit Jahrzehnten ambivalent in Bezug
421.8,427.08, China has acted increasingly aggressively when it comes to Taiwan. That poses a threat to peace,"China hat in Bezug auf Taiwan zunehmend aggressiv gehandelt, was"
427.08,432.28, and stability in the entire region. The Chinese foreign minister must have asked you to explain,"Der chinesische Außenminister muß Sie gefragt haben, warum Sie"
432.28,440.04," the president's remarks. Well, we had a conversation about our different approaches to Taiwan.","Nun, wir haben ein Gespräch über unsere unterschiedlichen Ansätze in Bezug auf Taiwan geführt."
440.44,445.4," And I reiterated what the president has said and what he said clearly and consistently,","Und ich habe wiederholt, was der Präsident gesagt hat und was"
446.52,454.28," our continuity adherence to the one China policy, our determination that the differences","Unsere Kontinuität, unsere Einigkeit in der Politik China, unsere Ent"
454.28,462.04," be resolved peacefully, our insistence that peace and stability be maintained in the Taiwan","friedlich gelöst werden, unser Drängen, Frieden und Stabilität in Taiwan"
462.04,468.2," straits, and our deep concern that China was taking actions to try to change that status quo.","straits, und unsere tiefe Besorgnis darüber, dass China Maßnahmen"
468.2,474.68, That's what the issue is. Blinken warns that turbulence in the Taiwan strait would wash around,"Blinken warnt, dass Turbulenzen in der Taiwan-Straße um"
474.68,482.04, the world. Taiwan itself were anything to happen. It is where virtually all the semiconductors,"Taiwan selbst würde es schaffen, denn dort stünden praktisch alle"
483.16,488.92, are made. One of the reasons we're now investing so heavily in our own capacity,"Einer der Gründe, warum wir jetzt so stark in unsere eigene Kapazität investieren"
488.92,494.04," to produce semiconductors here in the United States. We design them, but the actual production","Wir konzipieren Halbleiter, aber die eigentliche Produktion"
494.04,498.28," is done in a handful of places in Taiwan produces most of them. If that's disrupted,","- es gibt eine Handvoll Orte in Taiwan, die die meisten von"
498.28,501.64, the effects that that would have on the global economy could be devastating.,"die Auswirkungen, die dies auf die Weltwirtschaft hätte, könnten verheerend sein"
501.64,508.2000000000001," Last week on 60 minutes, the president of Iran told Leslie Stahl he would consider re-entering",In der vergangenen Woche hat der iranische Präsident Leslie Stahl in 60
508.2000000000001,514.52, the deal to restrict Iran's nuclear weapons program. The Trump administration had cancelled it.,"- es hat sich erwiesen, dass die iranische Regierung"
514.52,520.2, Blinken doubts that Iran is serious. Iran has continued to try to add,"Blinken bezweifelt, dass der Iran ernst ist."
520.5200000000001,528.12, extraneous issues to the negotiation that we're simply not going to say yes to. We will not,- - - - - - - - -
528.12,533.8000000000001, accept a bad deal. The response that they've given to the last proposals put forward by our European,"Die Antwort, die sie auf die letzten Vorschläge unserer europäischen"
533.8000000000001,540.2800000000001," partners have been a very significant step backwards, and so I don't see any prospects in the","Partner haben einen sehr wichtigen Rückschritt gemacht, und deshalb sehe ich keine Perspektive"
540.2800000000001,546.84, very near term to bring this to a conclusion. Anthony Blinken is 60. One of his grandparents,Anthony Blinken hat 60 Jahre. Einer seiner Großeltern hat
546.84,553.8000000000001," was born in Ukraine. His stepfather survived the Holocaust, and his father was a U.S. ambassador.","Er studierte in der Ukraine und überlebte den Holocaust, und sein Vater war US"
554.44,561.32," Blinken has spent 30 years in foreign policy for Democrats, mostly in the Senate and the White House.","Blinken hat 30 Jahre in der Außenpolitik für Demokraten verbracht,"
561.32,567.72, That's him in the back of the room during the strike on Osama bin Laden. His philosophy on,Während des Streiks gegen Osama bin Laden sitzt er
567.72,575.0, American diplomacy is robust engagement with what he calls humility and confidence.,"Die amerikanische Diplomatie ist ein robustes Engagement mit dem, was er"
575.56,582.36," If we don't engage, if we're not leading, then one of two things. Either someone else is,","Wenn wir uns nicht engagieren, wenn wir nicht leiten, dann ist das"
582.36,587.32," and probably not in a way that's going to advance our interests and values, or no one is,","und wahrscheinlich nicht auf eine Weise, die unsere Interessen und Werte voranbringen wird,"
587.32,591.24, and then you tend to have chaos. You get a vacuum that's filled by bad things before it's filled,"- es gibt eine ganze Reihe von Situationen, in denen man"
591.24,596.76," with good things, because the world does not organize itself. There's not a single big problem",- es gibt keinen einzigen großen Problem
596.76,602.92," that's affecting the lives of our citizens that we can effectively solve alone, whether it's climate,",", die das Leben unserer Bürger beeinträchtigt und die wir allein wirksam"
602.92,607.56," whether it's COVID, whether it's the effect of all of these emerging technologies on our lives.","ob es COVID ist, ob es die"
608.4399999999999,612.92, We have to be working with others to try to shape all of this in a way that's actually going to,"Wir müssen mit anderen zusammenarbeiten, um zu versuchen, all dies so zu gestalten, dass"
612.92,617.88," make our people, as well as other people, a little bit more secure, a little bit more prosperous,","Unsere Menschen, aber auch andere Menschen, ein wenig sicherer, ein wenig wohlhabender"
617.88,625.0," a little bit more full of opportunity. Given January 6th, given the fabricated controversy over",a little bit more full of opportunity.
625.0,632.8399999999999," the election results, do you find that countries around the world are worried about the stability","Die Wahlergebnisse, stelle ich fest, dass sich Länder auf der ganzen Welt Sorge"
632.84,639.4, of the United States? It's no secret that we have challenges within our own democracy.,"Es ist kein Geheimnis, dass wir innerhalb unserer eigenen Demok"
640.12,643.96," They're playing out before the entire world. We don't sweep them under the rug,","Sie spielen vor der ganzen Welt aus, wir schweifen sie nicht unter den"
644.76,651.24," even when it's painful. So I'm able to say to other countries that bring these up, yes,","Ich kann also anderen Ländern, die dieses Thema ansprechen, sagen, ja,"
651.24,656.44," we've got our problems, but we're confronting them. We're dealing with them. You might do the same","Wir haben unsere Probleme, aber wir konfrontieren sie. Wir befassen uns mit ihnen"
656.44,665.72," thing. Your father was US ambassador to Hungary, and as we sit here on Friday afternoon, he passed away","Ihr Vater war US-Botschafter in Ungarn, und heute, am Freitag Nachmittag"
665.72,675.1600000000001, last night. And I wonder why you decided to keep such a busy schedule the day after that tragedy,"Und ich frage mich, warum Sie sich entschlossen haben, einen so"
675.1600000000001,685.8800000000001, in your family. My dad was 96 years old. He was in so many ways my role model. He built,Deine Familie. Mein Vater war 96 Jahre alt. Er war in so vielen
686.6,692.0400000000001," a remarkable business, one of the leading investment banks in this country over many years. He let","er hat eine bemerkenswerte Geschäfte, eine der führenden Investment"
692.0400000000001,702.7600000000001," a life of dignity, of decency, of modesty, that is something I've very much aspired to. And so I guess","ich hoffe, dass ich bald wieder ein Leben in Würde,"
702.7600000000001,709.72," I thought that honoring everything that he shared with me, the best way to do that was to continue","Ich dachte, dass die beste Möglichkeit, das zu tun, war, alles, was"
709.72,717.0, doing my job. That job for the foreseeable future will be consumed with a question that has,"- ich arbeite, und ich werde in absehbarer"
717.0,723.96, defeated generations of diplomats. How to keep a small war in Europe from igniting the world.,"Wie kann man verhindern, dass ein kleiner Krieg in Europa die Welt entfacht."
724.84,728.44, Are there any talks currently that we may not have heard about?,"Gibt es derzeit Gespräche, von denen wir vielleicht nicht gehört haben?"
728.44,732.6, There are no talks because Russia has not demonstrated any willingness in this moment,"Es gibt keine Gespräche, weil Russland in diesem Moment keine Bereitschaft gezeigt hat"
733.48,738.76," to engage in meaningful discussions. If and when that changes, we will do everything we can to","Wenn sich dies ändert, werden wir alles in unserer Macht Stehende"
738.76,745.16, support a diplomatic process. Is Vladimir Putin losing this war? He's already lost in terms of what,"Wladimir Putin verliert diesen Krieg? Er hat bereits verloren,"
745.16,750.28, he was trying to achieve because keep in mind what he said very clearly from the start is his,"er versuchte zu erreichen, denn denken Sie daran, was er von Anfang"
750.28,757.0, objective was to erase Ukraine's identity as an independent country. That has already failed.,"Ziel war es, die Identität der Ukraine als unabhängiges Land zu"
757.56,762.12, Ukrainians are fighting for their own land. They're fighting for their own country. The Russians are,"Die Ukrainer kämpfen für ihr eigenes Land, sie kämpfen für ihr eigene"
762.12,768.6," not. And these Russian soldiers who are being thrown into this conflict, often not knowing where they're","Und diese russischen Soldaten, die in diesen Konflikt geworfen werden,"
768.6,775.08, going or what they're doing. This is not something that they want to be fighting for. The Ukrainians are,- - - - - - - - -
775.08,786.52, fighting for their own future. They're fighting for their own land. They're fighting for their own lives.,kämpfen für ihre eigene Zukunft. kämpfen sie für ihr eigenes Land.
